{
  "schema_version": 1,
  "sequence": 6,
  "pair_id": "vs2-inputs",
  "recorded_at": "2026-09-20T06:57:14+00:00",
  "previous_hash": "8c58dc9cc53e9b01c6bed4d68c24740f9fc68b74dee8bccb4ed3d5fb3dd66285",
  "kind": "verification",
  "round_id": "r3",
  "actor": {
    "client": "Codex desktop",
    "cli_version": "not exposed",
    "model": "GPT-6",
    "session": "vs2-inputs-2026-09-20"
  },
  "payload": {
    "stage": "locally_prepared",
    "diary": "ba1cf530b8b6c95209380947ecf4339c55586b66",
    "semantic": "520d50fd6f9c9349773230f248ed537409edaa77",
    "feedback": "https://github.com/FinnNk/Meerkritic/pull/10#issuecomment-5748233592",
    "checks": "New diary and semantic pass115 tests and all gates; exact final tree equality. Earlier exact commits unchanged.",
    "platform_approval": false
  },
  "event_hash": "c0e14777c38735cb913fc079a40912cc8ddc85d2e0f449f48da02985d556bb8d"
}
