{
  "schema_version": 1,
  "sequence": 9,
  "pair_id": "vs1-dataset-browser",
  "recorded_at": "2026-09-19T20:09:41+00:00",
  "previous_hash": "8aa45bf1c574c662d9a0104bb2f794fab31e1b6802dd91a0fb221ef06ccbb87c",
  "kind": "observation",
  "round_id": "r3",
  "actor": {
    "client": "Codex desktop",
    "cli_version": "not exposed",
    "model": "GPT-6",
    "session": "meerkritic-vs1-2026-09-19"
  },
  "payload": {
    "stage": "owner_review_ready",
    "publication": "complete",
    "pr": "https://github.com/FinnNk/Meerkritic/pull/3",
    "head": "8e5e77f406639c88655c88c20341083f655e7013",
    "base": "3db848bd0992d0686bb5c45ddadd87ec6fbde8d2",
    "commits": [
      "cc0bca41402601028826865539c819375e23f0b9",
      "16a2b9daf89544df4550f53dda41f48f2c921b31",
      "8e5e77f406639c88655c88c20341083f655e7013"
    ],
    "archive_commit": "2d8cd8d3024eeb70ef35f1afcbff8279141c71b6",
    "archive_bundle_git_blob": "2a346ecb23584ede7e5dc08c9f6a0f7f13be6182",
    "archive_access_verified": true,
    "pr_description": "updated with three capability commits and per-checkpoint verification",
    "hosted_required_contexts": [],
    "hosted_checks_observed": [],
    "platform_approval": false,
    "review_state": "REVIEW_REQUIRED",
    "integration": "not performed",
    "working_tree": "clean; follows updated feature branch",
    "feedback_disposition": "addressed",
    "final_application_content": "unchanged"
  },
  "event_hash": "1ce90bf195a885f3a695f37811ec1563bf6361883f413af034d0f06ccfc78e4f"
}
