{
  "schema_version": 1,
  "sequence": 10,
  "pair_id": "vs1-dataset-browser",
  "recorded_at": "2026-09-19T20:37:49+00:00",
  "previous_hash": "1ce90bf195a885f3a695f37811ec1563bf6361883f413af034d0f06ccfc78e4f",
  "kind": "observation",
  "round_id": "r4",
  "actor": {
    "client": "Codex desktop",
    "cli_version": "not exposed",
    "model": "GPT-6",
    "session": "meerkritic-vs1-2026-09-19"
  },
  "payload": {
    "stage": "locally_prepared",
    "feedback": "https://github.com/FinnNk/Meerkritic/pull/3#issuecomment-5744986964 and subsequent owner agreement in Codex",
    "disposition": "comments incorporated into introducing semantic capabilities; separate baseline backfill and guidance; owner accepts preserving source records",
    "diary": "797d8189ff7194bf025885ab0815b3f301fa21d2",
    "semantic": "c66dcfe605e00a8b3ea41208647df11bb7be4da6",
    "tree": "dc03ff60ee94dfbe4dbac25c9f1a7081b97fa3c7",
    "prior_published": "8e5e77f406639c88655c88c20341083f655e7013",
    "checks": "canonical gates pass in all six checkpoint environments: 11/14/15/15/15/15 tests; AST and architecture audits pass; diary final passes",
    "review": "r4/review.md: complete self-review, not independent",
    "adr_statuses": {
      "ADR-0001": "accepted",
      "ADR-0002": "implemented",
      "ADR-0003": "implemented"
    },
    "publication": "not yet performed"
  },
  "event_hash": "85df414197e084ba5e0a4bead021ba3dc74b16c7e558045b6b88749d620311ff"
}
