{
  "schema_version": 1,
  "sequence": 1,
  "pair_id": "vs2-interaction",
  "recorded_at": "2026-09-20T09:39:43+00:00",
  "previous_hash": null,
  "kind": "verification",
  "round_id": "r1",
  "actor": {
    "client": "Codex desktop",
    "cli_version": "not exposed",
    "model": "GPT-6",
    "session": "vs2-interaction-2026-09-20"
  },
  "payload": {
    "stage": "locally_prepared",
    "base": "ff9af2e68d989590ebe030002e2e3789c35efef0",
    "diary": "6bf1544b1fa1f70f188ae19fd08f55df78574787",
    "semantic": "eaeecaafd37883f2cb6da09d2845886413a9a530",
    "records": [
      "verification-summary.json",
      "review.json",
      "equivalence.json"
    ],
    "summary": "Checkpoint-owned checks, live synthetic compatibility, full self-review, exact final tree equality and canonical local snapshot complete. Remote replication and owner acceptance pending."
  },
  "event_hash": "637707b160aaa3cb069cc58c5e0433dee38d69b6c4f48b79c646a365c9461c8f"
}
